{
  "$schema": "../data/responses.schema.json",
  "instrument": "qcae",
  "instrumentVersion": "1.1.0",
  "locale": "en",
  "responses": {
    "1": 2,
    "2": 3,
    "3": 4,
    "4": 3,
    "5": 3,
    "6": 4,
    "7": 2,
    "8": 2,
    "9": 3,
    "10": 3,
    "11": 2,
    "12": 3,
    "13": 3,
    "14": 2,
    "15": 4,
    "16": 3,
    "17": 2,
    "18": 4,
    "19": 3,
    "20": 4,
    "21": 3,
    "22": 3,
    "23": 3,
    "24": 2,
    "25": 3,
    "26": 3,
    "27": 3,
    "28": 4,
    "29": 2,
    "30": 4,
    "31": 3
  },
  "synthetic": true
}
